{
  "schemaVersion": "0.2.0",
  "system": "instrument",
  "job": "W",
  "move": "Running index",
  "format": "html",
  "instructionBuild": "full",
  "title": "Wayfinding narrow acceptance",
  "viewports": [
    {
      "width": 320,
      "height": 844
    }
  ],
  "content": {
    "kind": "runningIndex",
    "data": {
      "document": "Standards implementation handbook",
      "folio": "08 / 24",
      "sections": [
        "Purpose",
        "Principles",
        "Evidence",
        "Structure",
        "Narrative",
        "Change",
        "Transaction",
        "Wayfinding"
      ],
      "current": 8,
      "note": "The active section remains explicit without relying on colour alone."
    }
  }
}
